{
  "$schema": "https://json-schema.org/draft/2020-12/schema",
  "$id": "https://openvision.local/schemas/skill_manifest.schema.json",
  "title": "SkillManifest",
  "type": "object",
  "required": [
    "id",
    "name",
    "description",
    "input_schema",
    "result_schema",
    "latency_class",
    "local_first",
    "cloud_allowed",
    "privacy_level",
    "hud_policy",
    "timeout_ms",
    "local_resources",
    "activation_phrases_vi",
    "acceptance_tests",
    "failure_modes"
  ],
  "additionalProperties": false,
  "properties": {
    "id": {"type": "string"},
    "version": {"type": "string"},
    "name": {"type": "string"},
    "description": {"type": "string"},
    "input_schema": {"type": "object"},
    "result_schema": {"type": "object"},
    "latency_class": {"type": "string", "enum": ["live", "interactive", "deep"]},
    "local_first": {"type": "boolean"},
    "cloud_allowed": {"type": "boolean"},
    "privacy_level": {"type": "string", "enum": ["low", "medium", "high", "sensitive"]},
    "hud_policy": {"type": "string"},
    "timeout_ms": {"type": "integer", "minimum": 1},
    "local_resources": {"type": "array", "items": {"type": "string"}},
    "activation_phrases_vi": {"type": "array", "items": {"type": "string"}},
    "activation_phrases_en": {"type": "array", "items": {"type": "string"}},
    "acceptance_tests": {"type": "array", "items": {"type": "string"}},
    "failure_modes": {"type": "array", "items": {"type": "string"}}
  }
}
