{
  "id": "openvision.skill.select_target",
  "version": "0.1.0",
  "name": "select_target",
  "description": "Set the active selected target for follow-up visual questions.",
  "latency_class": "live",
  "local_first": true,
  "cloud_allowed": false,
  "privacy_level": "medium",
  "hud_policy": "target_hint",
  "timeout_ms": 1000,
  "local_resources": ["selected_target_state"],
  "activation_phrases_vi": ["chọn người này", "theo dõi mục tiêu này"],
  "activation_phrases_en": ["select target", "track this target"],
  "input_schema": {
    "type": "object",
    "properties": {
      "target_id": {"type": "string", "minLength": 1},
      "reason": {"type": "string"}
    },
    "required": ["target_id"],
    "additionalProperties": false
  },
  "result_schema": {
    "type": "object",
    "properties": {
      "selected_target": {"type": "object"},
      "hud_hint": {"type": "object"}
    },
    "required": ["selected_target"],
    "additionalProperties": false
  },
  "acceptance_tests": ["stores selected target by session", "does not call cloud"],
  "failure_modes": ["target_id missing", "candidate expired"]
}
